{
  "$schema": "https://json-schema.org/draft/2020-12/schema",
  "$id": "urn:ai-brand-os:artifact:2.4.0:quality_assessment",
  "type": "object",
  "properties": {
    "artifactId": {
      "type": "string",
      "format": "uuid"
    },
    "artifactType": {
      "const": "PROCESSING_INTERMEDIATE"
    },
    "parentArtifactId": {
      "anyOf": [
        {
          "type": "string",
          "format": "uuid"
        },
        {
          "type": "null"
        }
      ]
    },
    "conversationId": {
      "anyOf": [
        {
          "type": "string",
          "format": "uuid"
        },
        {
          "type": "null"
        }
      ]
    },
    "correlationId": {
      "type": "string",
      "format": "uuid"
    },
    "organizationId": {
      "type": "string",
      "format": "uuid"
    },
    "producingService": {
      "enum": [
        "DOCUMENT_PROCESSING",
        "KNOWLEDGE_EXTRACTION",
        "KNOWLEDGE_MANAGEMENT",
        "CONTEXT_ENGINE"
      ]
    },
    "producingStage": {
      "const": "quality_assessment"
    },
    "schemaVersion": {
      "const": "2.4.0"
    },
    "status": {
      "const": "VALID"
    },
    "createdAt": {
      "type": "string",
      "format": "date-time"
    },
    "payload": {
      "type": "object",
      "properties": {
        "variant": {
          "const": "quality_assessment"
        },
        "operationStatus": {
          "const": "SUCCEEDED"
        },
        "brandId": {
          "type": "string",
          "format": "uuid"
        },
        "invocationId": {
          "type": "string",
          "format": "uuid"
        },
        "attemptNumber": {
          "type": "integer",
          "minimum": 1
        },
        "checkpointNumber": {
          "type": "integer",
          "minimum": 0
        },
        "data": {
          "$ref": "urn:ai-brand-os:knowledge-quality:1.0.0:assessment"
        },
        "error": {
          "type": "null"
        }
      },
      "required": [
        "variant",
        "operationStatus",
        "brandId",
        "invocationId",
        "attemptNumber",
        "checkpointNumber",
        "data",
        "error"
      ],
      "additionalProperties": false
    }
  },
  "required": [
    "artifactId",
    "artifactType",
    "parentArtifactId",
    "conversationId",
    "correlationId",
    "organizationId",
    "producingService",
    "producingStage",
    "schemaVersion",
    "status",
    "createdAt",
    "payload"
  ],
  "additionalProperties": false
}
